{
  "$schema": "http://json-schema.org/draft-07/schema#",
  "$id": "https://paa.dev/paa-operating-record.schema.json",
  "title": "PAA Operating Record",
  "description": "Optional subject-linked accounting artifact, independent of evaluator verdict count and autonomy transitions. Task or pipeline summaries must retain source attribution to constituent attempts, usage, model/rate identities and pricing bases. Readers must not add a summary and its constituents as separate charges.",
  "x-paa-schema-version": "paa-operating-record/0.1.0-draft",
  "type": "object",
  "required": ["record_schema", "record_id", "task", "declaration_version", "scope", "subject", "worker", "usage", "price", "timestamps", "source_references"],
  "additionalProperties": false,
  "definitions": {
    "worker": {
      "type": "object",
      "required": ["id", "version", "configuration_ref"],
      "additionalProperties": false,
      "properties": {
        "id": { "type": "string", "minLength": 1 },
        "version": { "type": "string", "minLength": 1 },
        "configuration_ref": { "type": "string", "minLength": 1 }
      }
    },
    "price": {
      "type": ["object", "null"],
      "description": "Null means unavailable, never zero. A non-null price declares the currency and opaque rate/catalog basis; provenance must distinguish measured amounts from estimates and state coverage.",
      "required": ["currency", "amount", "basis"],
      "additionalProperties": false,
      "properties": {
        "currency": { "type": "string", "minLength": 1 },
        "amount": { "type": "number", "minimum": 0 },
        "basis": { "type": "string", "minLength": 1 }
      }
    }
  },
  "properties": {
    "record_schema": { "const": "paa-operating-record/0.1.0-draft" },
    "record_id": { "type": "string", "minLength": 1 },
    "task": { "type": "string", "pattern": "^[a-z][a-z0-9_]*$", "minLength": 1 },
    "declaration_version": { "type": "integer", "minimum": 1 },
    "scope": { "type": ["string", "null"], "minLength": 1 },
    "subject": {
      "type": "object",
      "required": ["kind", "id"],
      "additionalProperties": false,
      "properties": {
        "kind": { "type": "string", "enum": ["case", "run"] },
        "id": { "type": "string", "minLength": 1 }
      }
    },
    "worker": { "$ref": "#/definitions/worker" },
    "usage": {
      "type": ["object", "null"],
      "description": "Consumer-defined nonnegative quantities. input_tokens, output_tokens, cached_tokens and llm_calls are recommended, not an exhaustive vocabulary. Null quantities (or null usage) are explicitly unavailable. Omitted measures make no coverage claim. Aggregate tokens alone cannot reprice mixed-model work.",
      "minProperties": 1,
      "propertyNames": { "minLength": 1 },
      "additionalProperties": { "type": ["number", "null"], "minimum": 0 }
    },
    "price": { "$ref": "#/definitions/price" },
    "components": {
      "type": "array",
      "description": "Additional costs NOT already included in price. Component kinds have consumer-defined meaning. An omitted array makes no completeness claim.",
      "items": {
        "type": "object",
        "required": ["kind", "quantity", "unit", "price"],
        "additionalProperties": false,
        "properties": {
          "kind": { "type": "string", "minLength": 1 },
          "quantity": { "type": ["number", "null"], "minimum": 0 },
          "unit": { "type": "string", "minLength": 1 },
          "price": { "$ref": "#/definitions/price" }
        }
      }
    },
    "timestamps": {
      "type": "object",
      "required": ["started_at", "completed_at", "recorded_at"],
      "additionalProperties": false,
      "properties": {
        "started_at": { "type": "string", "format": "date-time" },
        "completed_at": { "type": "string", "format": "date-time" },
        "recorded_at": { "type": "string", "format": "date-time" }
      }
    },
    "source_references": {
      "type": "array",
      "description": "Durable references identifying covered work, scopes, configurations, individual attempts (including failed and superseded retries), quantities, model/rate identities, pricing bases and measurement coverage. Multiple verdicts do not create new charges. PAA preserves these references but cannot verify external provenance or deduplicate overlapping summaries.",
      "minItems": 1,
      "uniqueItems": true,
      "items": { "type": "string", "minLength": 1 }
    }
  }
}
